[
  {
    "legacy_id": "0",
    "kind": "level",
    "source_file": "config/main.json",
    "source_layer": "stored",
    "content_version": "004ba829043dfb00d78888a764bd7e13a37db9c5c05195cd910ac3d570678bb3",
    "level_index": 0,
    "name": "Slave",
    "exp_required": 0,
    "reward_type": "s",
    "reward_amount": 50
  },
  {
    "legacy_id": "1",
    "kind": "level",
    "source_file": "config/main.json",
    "source_layer": "stored",
    "content_version": "004ba829043dfb00d78888a764bd7e13a37db9c5c05195cd910ac3d570678bb3",
    "level_index": 1,
    "name": "Servant",
    "exp_required": 40,
    "reward_type": "w",
    "reward_amount": 250
  },
  {
    "legacy_id": "2",
    "kind": "level",
    "source_file": "config/main.json",
    "source_layer": "stored",
    "content_version": "004ba829043dfb00d78888a764bd7e13a37db9c5c05195cd910ac3d570678bb3",
    "level_index": 2,
    "name": "Peon",
    "exp_required": 60,
    "reward_type": "s",
    "reward_amount": 250
  },
  {
    "legacy_id": "3",
    "kind": "level",
    "source_file": "config/main.json",
    "source_layer": "stored",
    "content_version": "004ba829043dfb00d78888a764bd7e13a37db9c5c05195cd910ac3d570678bb3",
    "level_index": 3,
    "name": "Peasant",
    "exp_required": 100,
    "reward_type": "g",
    "reward_amount": 250
  },
  {
    "legacy_id": "4",
    "kind": "level",
    "source_file": "config/main.json",
    "source_layer": "stored",
    "content_version": "004ba829043dfb00d78888a764bd7e13a37db9c5c05195cd910ac3d570678bb3",
    "level_index": 4,
    "name": "Villager",
    "exp_required": 200,
    "reward_type": "c",
    "reward_amount": 1
  },
  {
    "legacy_id": "5",
    "kind": "level",
    "source_file": "config/main.json",
    "source_layer": "stored",
    "content_version": "004ba829043dfb00d78888a764bd7e13a37db9c5c05195cd910ac3d570678bb3",
    "level_index": 5,
    "name": "Scout",
    "exp_required": 350,
    "reward_type": "c",
    "reward_amount": 1
  },
  {
    "legacy_id": "6",
    "kind": "level",
    "source_file": "config/main.json",
    "source_layer": "stored",
    "content_version": "004ba829043dfb00d78888a764bd7e13a37db9c5c05195cd910ac3d570678bb3",
    "level_index": 6,
    "name": "Cadet",
    "exp_required": 550,
    "reward_type": "c",
    "reward_amount": 1
  },
  {
    "legacy_id": "7",
    "kind": "level",
    "source_file": "config/main.json",
    "source_layer": "stored",
    "content_version": "004ba829043dfb00d78888a764bd7e13a37db9c5c05195cd910ac3d570678bb3",
    "level_index": 7,
    "name": "Squire",
    "exp_required": 800,
    "reward_type": "c",
    "reward_amount": 1
  },
  {
    "legacy_id": "8",
    "kind": "level",
    "source_file": "config/main.json",
    "source_layer": "stored",
    "content_version": "004ba829043dfb00d78888a764bd7e13a37db9c5c05195cd910ac3d570678bb3",
    "level_index": 8,
    "name": "Soldier",
    "exp_required": 1113,
    "reward_type": "c",
    "reward_amount": 1
  },
  {
    "legacy_id": "9",
    "kind": "level",
    "source_file": "config/main.json",
    "source_layer": "stored",
    "content_version": "004ba829043dfb00d78888a764bd7e13a37db9c5c05195cd910ac3d570678bb3",
    "level_index": 9,
    "name": "Footman",
    "exp_required": 1504,
    "reward_type": "c",
    "reward_amount": 1
  },
  {
    "legacy_id": "10",
    "kind": "level",
    "source_file": "config/main.json",
    "source_layer": "stored",
    "content_version": "004ba829043dfb00d78888a764bd7e13a37db9c5c05195cd910ac3d570678bb3",
    "level_index": 10,
    "name": "Swordsman",
    "exp_required": 1993,
    "reward_type": "c",
    "reward_amount": 1
  },
  {
    "legacy_id": "11",
    "kind": "level",
    "source_file": "config/main.json",
    "source_layer": "stored",
    "content_version": "004ba829043dfb00d78888a764bd7e13a37db9c5c05195cd910ac3d570678bb3",
    "level_index": 11,
    "name": "Halberdman",
    "exp_required": 2604,
    "reward_type": "c",
    "reward_amount": 1
  },
  {
    "legacy_id": "12",
    "kind": "level",
    "source_file": "config/main.json",
    "source_layer": "stored",
    "content_version": "004ba829043dfb00d78888a764bd7e13a37db9c5c05195cd910ac3d570678bb3",
    "level_index": 12,
    "name": "Lancer",
    "exp_required": 3368,
    "reward_type": "c",
    "reward_amount": 1
  },
  {
    "legacy_id": "13",
    "kind": "level",
    "source_file": "config/main.json",
    "source_layer": "stored",
    "content_version": "004ba829043dfb00d78888a764bd7e13a37db9c5c05195cd910ac3d570678bb3",
    "level_index": 13,
    "name": "Grunt",
    "exp_required": 4323,
    "reward_type": "c",
    "reward_amount": 1
  },
  {
    "legacy_id": "14",
    "kind": "level",
    "source_file": "config/main.json",
    "source_layer": "stored",
    "content_version": "004ba829043dfb00d78888a764bd7e13a37db9c5c05195cd910ac3d570678bb3",
    "level_index": 14,
    "name": "Knight",
    "exp_required": 5517,
    "reward_type": "c",
    "reward_amount": 1
  },
  {
    "legacy_id": "15",
    "kind": "level",
    "source_file": "config/main.json",
    "source_layer": "stored",
    "content_version": "004ba829043dfb00d78888a764bd7e13a37db9c5c05195cd910ac3d570678bb3",
    "level_index": 15,
    "name": "Private",
    "exp_required": 7010,
    "reward_type": "c",
    "reward_amount": 1
  },
  {
    "legacy_id": "16",
    "kind": "level",
    "source_file": "config/main.json",
    "source_layer": "stored",
    "content_version": "004ba829043dfb00d78888a764bd7e13a37db9c5c05195cd910ac3d570678bb3",
    "level_index": 16,
    "name": "Second Lieutenant",
    "exp_required": 8876,
    "reward_type": "c",
    "reward_amount": 1
  },
  {
    "legacy_id": "17",
    "kind": "level",
    "source_file": "config/main.json",
    "source_layer": "stored",
    "content_version": "004ba829043dfb00d78888a764bd7e13a37db9c5c05195cd910ac3d570678bb3",
    "level_index": 17,
    "name": "Lieutenant",
    "exp_required": 11209,
    "reward_type": "c",
    "reward_amount": 1
  },
  {
    "legacy_id": "18",
    "kind": "level",
    "source_file": "config/main.json",
    "source_layer": "stored",
    "content_version": "004ba829043dfb00d78888a764bd7e13a37db9c5c05195cd910ac3d570678bb3",
    "level_index": 18,
    "name": "Corporal",
    "exp_required": 13659,
    "reward_type": "c",
    "reward_amount": 1
  },
  {
    "legacy_id": "19",
    "kind": "level",
    "source_file": "config/main.json",
    "source_layer": "stored",
    "content_version": "004ba829043dfb00d78888a764bd7e13a37db9c5c05195cd910ac3d570678bb3",
    "level_index": 19,
    "name": "Marauder",
    "exp_required": 16232,
    "reward_type": "c",
    "reward_amount": 1
  },
  {
    "legacy_id": "20",
    "kind": "level",
    "source_file": "config/main.json",
    "source_layer": "stored",
    "content_version": "004ba829043dfb00d78888a764bd7e13a37db9c5c05195cd910ac3d570678bb3",
    "level_index": 20,
    "name": "Captain",
    "exp_required": 18934,
    "reward_type": "c",
    "reward_amount": 1
  },
  {
    "legacy_id": "21",
    "kind": "level",
    "source_file": "config/main.json",
    "source_layer": "stored",
    "content_version": "004ba829043dfb00d78888a764bd7e13a37db9c5c05195cd910ac3d570678bb3",
    "level_index": 21,
    "name": "Sergeant",
    "exp_required": 21771,
    "reward_type": "c",
    "reward_amount": 1
  },
  {
    "legacy_id": "22",
    "kind": "level",
    "source_file": "config/main.json",
    "source_layer": "stored",
    "content_version": "004ba829043dfb00d78888a764bd7e13a37db9c5c05195cd910ac3d570678bb3",
    "level_index": 22,
    "name": "Senior Sergeant",
    "exp_required": 24750,
    "reward_type": "c",
    "reward_amount": 1
  },
  {
    "legacy_id": "23",
    "kind": "level",
    "source_file": "config/main.json",
    "source_layer": "stored",
    "content_version": "004ba829043dfb00d78888a764bd7e13a37db9c5c05195cd910ac3d570678bb3",
    "level_index": 23,
    "name": "First Sergeant",
    "exp_required": 27878,
    "reward_type": "c",
    "reward_amount": 1
  },
  {
    "legacy_id": "24",
    "kind": "level",
    "source_file": "config/main.json",
    "source_layer": "stored",
    "content_version": "004ba829043dfb00d78888a764bd7e13a37db9c5c05195cd910ac3d570678bb3",
    "level_index": 24,
    "name": "Master Sergeant",
    "exp_required": 31162,
    "reward_type": "c",
    "reward_amount": 1
  },
  {
    "legacy_id": "25",
    "kind": "level",
    "source_file": "config/main.json",
    "source_layer": "stored",
    "content_version": "004ba829043dfb00d78888a764bd7e13a37db9c5c05195cd910ac3d570678bb3",
    "level_index": 25,
    "name": "Sergeant Major",
    "exp_required": 34610,
    "reward_type": "c",
    "reward_amount": 1
  },
  {
    "legacy_id": "26",
    "kind": "level",
    "source_file": "config/main.json",
    "source_layer": "stored",
    "content_version": "004ba829043dfb00d78888a764bd7e13a37db9c5c05195cd910ac3d570678bb3",
    "level_index": 26,
    "name": "Major",
    "exp_required": 38230,
    "reward_type": "c",
    "reward_amount": 1
  },
  {
    "legacy_id": "27",
    "kind": "level",
    "source_file": "config/main.json",
    "source_layer": "stored",
    "content_version": "004ba829043dfb00d78888a764bd7e13a37db9c5c05195cd910ac3d570678bb3",
    "level_index": 27,
    "name": "Centurion",
    "exp_required": 42031,
    "reward_type": "c",
    "reward_amount": 1
  },
  {
    "legacy_id": "28",
    "kind": "level",
    "source_file": "config/main.json",
    "source_layer": "stored",
    "content_version": "004ba829043dfb00d78888a764bd7e13a37db9c5c05195cd910ac3d570678bb3",
    "level_index": 28,
    "name": "Legionnaire",
    "exp_required": 46022,
    "reward_type": "c",
    "reward_amount": 1
  },
  {
    "legacy_id": "29",
    "kind": "level",
    "source_file": "config/main.json",
    "source_layer": "stored",
    "content_version": "004ba829043dfb00d78888a764bd7e13a37db9c5c05195cd910ac3d570678bb3",
    "level_index": 29,
    "name": "Gladiator",
    "exp_required": 50213,
    "reward_type": "c",
    "reward_amount": 1
  },
  {